{
  "version": "1.0.0",
  "generated_at": "2026-09-19T20:00:54.723Z",
  "nodes": [
    {
      "id": "PROD-001",
      "type": "PRODUCT",
      "name": "Pharmacy POS for inventory and billing",
      "description": "Managing pharmacy inventory, sales, and prescription handling efficiently.",
      "version": "1",
      "status": "locked",
      "parent": null,
      "dependencies": [],
      "references": [],
      "evidence": [],
      "source_file": "product/product-contract.json",
      "created_at": "2026-09-19T20:00:54.715Z",
      "updated_at": "2026-09-19T20:00:54.715Z",
      "data": {}
    },
    {
      "id": "PERS-001",
      "type": "PERSONA",
      "name": "Pharmacist",
      "description": "Dispensary and stock oversight",
      "version": "1.0.0",
      "status": "confirmed",
      "parent": null,
      "dependencies": [],
      "references": [],
      "evidence": [],
      "source_file": "product/users.md",
      "created_at": "2026-09-19T20:00:54.716Z",
      "updated_at": "2026-09-19T20:00:54.716Z",
      "data": {}
    },
    {
      "id": "PERS-002",
      "type": "PERSONA",
      "name": "Cashier",
      "description": "Point of sale billing",
      "version": "1.0.0",
      "status": "confirmed",
      "parent": null,
      "dependencies": [],
      "references": [],
      "evidence": [],
      "source_file": "product/users.md",
      "created_at": "2026-09-19T20:00:54.717Z",
      "updated_at": "2026-09-19T20:00:54.717Z",
      "data": {}
    },
    {
      "id": "OUT-001",
      "type": "OUTCOME",
      "name": "Sub-150ms P95 latency on all primary workflows",
      "description": "Sub-150ms P95 latency on all primary workflows",
      "version": "1.0.0",
      "status": "active",
      "parent": null,
      "dependencies": [],
      "references": [],
      "evidence": [],
      "source_file": "product/outcomes.md",
      "created_at": "2026-09-19T20:00:54.717Z",
      "updated_at": "2026-09-19T20:00:54.717Z",
      "data": {}
    },
    {
      "id": "OUT-002",
      "type": "OUTCOME",
      "name": "100% operational uptime and local transaction survivability",
      "description": "100% operational uptime and local transaction survivability",
      "version": "1.0.0",
      "status": "active",
      "parent": null,
      "dependencies": [],
      "references": [],
      "evidence": [],
      "source_file": "product/outcomes.md",
      "created_at": "2026-09-19T20:00:54.717Z",
      "updated_at": "2026-09-19T20:00:54.717Z",
      "data": {}
    },
    {
      "id": "OUT-003",
      "type": "OUTCOME",
      "name": "Complete traceability from product requirements to test verification",
      "description": "Complete traceability from product requirements to test verification",
      "version": "1.0.0",
      "status": "active",
      "parent": null,
      "dependencies": [],
      "references": [],
      "evidence": [],
      "source_file": "product/outcomes.md",
      "created_at": "2026-09-19T20:00:54.717Z",
      "updated_at": "2026-09-19T20:00:54.717Z",
      "data": {}
    },
    {
      "id": "FEAT-001",
      "type": "FEATURE",
      "name": "Inventory Management",
      "description": "Track stock levels, reorder points, and item batches",
      "version": "1.0.0",
      "status": "confirmed",
      "parent": null,
      "dependencies": [],
      "references": [],
      "evidence": [],
      "source_file": "product/product-contract.md",
      "created_at": "2026-09-19T20:00:54.717Z",
      "updated_at": "2026-09-19T20:00:54.717Z",
      "data": {}
    },
    {
      "id": "FEAT-002",
      "type": "FEATURE",
      "name": "Billing & POS",
      "description": "Process sales transactions, taxes, and receipt generation",
      "version": "1.0.0",
      "status": "confirmed",
      "parent": null,
      "dependencies": [],
      "references": [],
      "evidence": [],
      "source_file": "product/product-contract.md",
      "created_at": "2026-09-19T20:00:54.717Z",
      "updated_at": "2026-09-19T20:00:54.717Z",
      "data": {}
    },
    {
      "id": "FEAT-003",
      "type": "FEATURE",
      "name": "Prescription Tracking",
      "description": "Record doctor prescriptions and patient dispensation history",
      "version": "1.0.0",
      "status": "confirmed",
      "parent": null,
      "dependencies": [],
      "references": [],
      "evidence": [],
      "source_file": "product/product-contract.md",
      "created_at": "2026-09-19T20:00:54.717Z",
      "updated_at": "2026-09-19T20:00:54.717Z",
      "data": {}
    },
    {
      "id": "REQ-001",
      "type": "REQUIREMENT",
      "name": "Inventory Management",
      "description": "Track stock levels, reorder points, and item batches",
      "version": "1.0.0",
      "status": "confirmed",
      "parent": null,
      "dependencies": [],
      "references": [],
      "evidence": [],
      "source_file": "product/acceptance.md",
      "created_at": "2026-09-19T20:00:54.717Z",
      "updated_at": "2026-09-19T20:00:54.717Z",
      "data": {
        "acceptance_criteria": [
          "Given an active store catalog, When an item quantity changes, Then the stock level updates immediately with timestamped audit logging.",
          "Given an item with stock below reorder threshold, When inventory status is queried, Then an alert flag is emitted.",
          "Given a concurrent sale and restock event, When transactions are committed, Then inventory updates are strictly serialized without negative balances."
        ]
      }
    },
    {
      "id": "REQ-002",
      "type": "REQUIREMENT",
      "name": "Billing & POS",
      "description": "Process sales transactions, taxes, and receipt generation",
      "version": "1.0.0",
      "status": "confirmed",
      "parent": null,
      "dependencies": [],
      "references": [],
      "evidence": [],
      "source_file": "product/acceptance.md",
      "created_at": "2026-09-19T20:00:54.717Z",
      "updated_at": "2026-09-19T20:00:54.717Z",
      "data": {
        "acceptance_criteria": [
          "Given a cart with valid items, When checkout is finalized, Then a tax-compliant receipt is generated with unique transaction ID.",
          "Given an offline terminal with cached product catalog, When a bill is processed, Then the sale is committed locally and queued for synchronization.",
          "Given an invalid or negative total, When checkout is attempted, Then the transaction is rejected with RFC 7807 problem details."
        ]
      }
    },
    {
      "id": "REQ-003",
      "type": "REQUIREMENT",
      "name": "Prescription Tracking",
      "description": "Record doctor prescriptions and patient dispensation history",
      "version": "1.0.0",
      "status": "confirmed",
      "parent": null,
      "dependencies": [],
      "references": [],
      "evidence": [],
      "source_file": "product/acceptance.md",
      "created_at": "2026-09-19T20:00:54.717Z",
      "updated_at": "2026-09-19T20:00:54.717Z",
      "data": {
        "acceptance_criteria": [
          "Given a patient record and prescribing doctor name, When prescription is registered, Then items and dosage instructions are durably stored.",
          "Given a prescription-only drug, When dispensed at POS, Then the system verifies matching prescription ID before authorizing sale.",
          "Given an expired or fully dispensed prescription, When dispensation is attempted, Then the action is blocked with an explicit error."
        ]
      }
    },
    {
      "id": "CONTRACT-001",
      "type": "CONTRACT",
      "name": "Product Contract v1",
      "description": "Cryptographic hash: sha256-ad5c7965d1949b6f79029e59f95fb88645cfccd82bbb740636534880534058d6",
      "version": "1",
      "status": "locked",
      "parent": null,
      "dependencies": [],
      "references": [],
      "evidence": [],
      "source_file": "product/product-contract.json",
      "created_at": "2026-09-19T20:00:54.717Z",
      "updated_at": "2026-09-19T20:00:54.717Z",
      "data": {}
    },
    {
      "id": "REQ-001.1",
      "type": "REQUIREMENT",
      "name": "REQ-001.1",
      "description": "Declared in specs/001-ai-task-copilot/spec.md",
      "version": "1.0.0",
      "status": "active",
      "parent": null,
      "dependencies": [],
      "references": [],
      "evidence": [],
      "source_file": "specs/001-ai-task-copilot/spec.md",
      "created_at": "2026-09-19T20:00:54.718Z",
      "updated_at": "2026-09-19T20:00:54.718Z",
      "data": {}
    },
    {
      "id": "REQ-001.2",
      "type": "REQUIREMENT",
      "name": "REQ-001.2",
      "description": "Declared in specs/001-ai-task-copilot/spec.md",
      "version": "1.0.0",
      "status": "active",
      "parent": null,
      "dependencies": [],
      "references": [],
      "evidence": [],
      "source_file": "specs/001-ai-task-copilot/spec.md",
      "created_at": "2026-09-19T20:00:54.718Z",
      "updated_at": "2026-09-19T20:00:54.718Z",
      "data": {}
    },
    {
      "id": "REQ-001.3",
      "type": "REQUIREMENT",
      "name": "REQ-001.3",
      "description": "Declared in specs/001-ai-task-copilot/spec.md",
      "version": "1.0.0",
      "status": "active",
      "parent": null,
      "dependencies": [],
      "references": [],
      "evidence": [],
      "source_file": "specs/001-ai-task-copilot/spec.md",
      "created_at": "2026-09-19T20:00:54.718Z",
      "updated_at": "2026-09-19T20:00:54.718Z",
      "data": {}
    },
    {
      "id": "TASK-001.1",
      "type": "TASK",
      "name": "TASK-001.1",
      "description": "**TASK-001.1**: Implement Task entity repository and in-memory/SQLite storage (maps to `REQ-001.1`)",
      "version": "1.0.0",
      "status": "completed",
      "parent": null,
      "dependencies": [],
      "references": [],
      "evidence": [],
      "source_file": "specs/001-ai-task-copilot/tasks.md",
      "created_at": "2026-09-19T20:00:54.718Z",
      "updated_at": "2026-09-19T20:00:54.718Z",
      "data": {}
    },
    {